{
  "schema_version": "1.3",
  "id": "thu-ha-noi",
  "name": "Thu Hà Nội",
  "dark": false,
  "description": "Nắng vàng hanh, lá sấu rơi, hương hoa sữa và cốm non.",
  "version": "1.0.3",
  "author": "Claude cho MewBook",
  "created": "2026-09-26",
  "inspired_by": "Mùa thu Hà Nội: phố cũ tường vàng, lá rơi, gánh cốm.",
  "tokens": {
    "bg": "#F6EEDC",
    "rail": "#EFE4CB",
    "panel": "#FFFBF2",
    "surface": "#FFFFFF",
    "surface2": "#F4EBD6",
    "ink": "#2E2418",
    "ink2": "#5E4F38",
    "ink3": "#736349",
    "line": "#E8DCC0",
    "line2": "#D0BD94",
    "accent": "#906418",
    "accentink": "#FFFFFF",
    "accentsoft": "#F6E6C2",
    "link": "#86560D",
    "shelf": "#C99A5B",
    "shelftop": "#F2DDB5",
    "under": "rgba(90,65,20,.12)",
    "shadow": "rgba(70,50,20,.30)",
    "ok": "#4E7822",
    "warn": "#A1441B",
    "err": "#A8283E",
    "scrim": "rgba(50,38,15,.36)"
  },
  "fonts": {
    "ui": {
      "family": "Be Vietnam Pro",
      "fallback": [
        "Segoe UI"
      ],
      "vietnamese": true
    },
    "content": {
      "family": "Lora",
      "fallback": [
        "Georgia"
      ],
      "vietnamese": true
    },
    "display": {
      "family": "Montserrat",
      "fallback": [
        "Segoe UI"
      ],
      "vietnamese": true
    }
  },
  "ornaments": {
    "shelf": {
      "style": "wood",
      "thickness": 8,
      "grain": "#B58548",
      "edge": "#9E733C",
      "brackets": true,
      "bracket_color": "#6B5A48"
    },
    "notice": {
      "style": "card"
    },
    "cover_frame": {
      "style": "line",
      "width": 2
    },
    "backdrop": {
      "style": "leaves",
      "position": "top",
      "height_pct": 55,
      "color": "#B8621E",
      "color2": "#D6A546",
      "opacity": 0.23
    }
  },
  "layouts": {
    "toi-gian": {
      "supported": true,
      "tokens": {
        "bg": "#EFE2C4",
        "rail": "#EFE2C4",
        "panel": "#FFFBF2",
        "shelf": "#E2D2AE"
      }
    }
  },
  "preview": [
    "preview/01_ke-sach_cua-so-chinh.png",
    "preview/02_ke-sach_nhap-xong.png",
    "preview/03_toi-gian_trang-dau.png",
    "preview/04_toi-gian_thu-vien.png"
  ]
}